{
  "name": "sqlite",
  "reviewed_duckdb": "1.5.5",
  "source": "https://github.com/duckdb/duckdb-sqlite/tree/f79b1db7d7730b18d0f8400d3650ffa6b45168d8",
  "notes": [
    "Source: https://github.com/duckdb/duckdb-sqlite/tree/f79b1db7d7730b18d0f8400d3650ffa6b45168d8"
  ],
  "compute": [],
  "elevated": [
    "sqlite_attach",
    "sqlite_query",
    "sqlite_scan"
  ]
}
