{
  "name": "spatial",
  "reviewed_duckdb": "1.5.5",
  "source": "https://github.com/duckdb/duckdb-spatial/tree/eb1e57c9d92c0f3f76eb03eaa52c315090f328cc",
  "notes": [
    "Source: https://github.com/duckdb/duckdb-spatial/tree/eb1e57c9d92c0f3f76eb03eaa52c315090f328cc"
  ],
  "compute": [
    "st_affine",
    "st_area",
    "st_area_spheroid",
    "st_asgeojson",
    "st_ashexwkb",
    "st_asmvt",
    "st_asmvtgeom",
    "st_assvg",
    "st_azimuth",
    "st_boundary",
    "st_buffer",
    "st_buildarea",
    "st_centroid",
    "st_closestpoint",
    "st_collect",
    "st_collectionextract",
    "st_concavehull",
    "st_contains",
    "st_containsproperly",
    "st_convexhull",
    "st_coverageclean",
    "st_coverageinvalidedges",
    "st_coverageinvalidedges_agg",
    "st_coveragesimplify",
    "st_coveragesimplify_agg",
    "st_coverageunion",
    "st_coverageunion_agg",
    "st_coveredby",
    "st_covers",
    "st_crosses",
    "st_difference",
    "st_dimension",
    "st_disjoint",
    "st_distance",
    "st_distance_geos",
    "st_distance_sphere",
    "st_distance_spheroid",
    "st_dump",
    "st_dwithin",
    "st_dwithin_geos",
    "st_dwithin_spheroid",
    "st_endpoint",
    "st_envelope",
    "st_envelope_agg",
    "st_equals",
    "st_expand",
    "st_extent",
    "st_extent_agg",
    "st_extent_approx",
    "st_exteriorring",
    "st_flipcoordinates",
    "st_force2d",
    "st_force3dm",
    "st_force3dz",
    "st_force4d",
    "st_geometrytype",
    "st_geomfromgeojson",
    "st_geomfromhexewkb",
    "st_geomfromhexwkb",
    "st_geomfromtext",
    "st_hasm",
    "st_hasz",
    "st_hilbert",
    "st_interiorringn",
    "st_interpolatepoint",
    "st_intersection",
    "st_intersection_agg",
    "st_intersects",
    "st_isclosed",
    "st_isempty",
    "st_isring",
    "st_issimple",
    "st_isvalid",
    "st_length",
    "st_length_spheroid",
    "st_lineinterpolatepoint",
    "st_lineinterpolatepoints",
    "st_linelocatepoint",
    "st_linemerge",
    "st_linestring2dfromwkb",
    "st_linesubstring",
    "st_locatealong",
    "st_locatebetween",
    "st_m",
    "st_makebox2d",
    "st_makeenvelope",
    "st_makeline",
    "st_makepoint",
    "st_makepolygon",
    "st_makevalid",
    "st_maximuminscribedcircle",
    "st_memunion_agg",
    "st_minimumrotatedrectangle",
    "st_mmax",
    "st_mmin",
    "st_multi",
    "st_ngeometries",
    "st_ninteriorrings",
    "st_node",
    "st_normalize",
    "st_npoints",
    "st_numgeometries",
    "st_numinteriorrings",
    "st_numpoints",
    "st_overlaps",
    "st_perimeter",
    "st_perimeter_spheroid",
    "st_point",
    "st_point2d",
    "st_point2dfromwkb",
    "st_point3d",
    "st_point4d",
    "st_pointn",
    "st_pointonsurface",
    "st_points",
    "st_polygon2dfromwkb",
    "st_polygonize",
    "st_quadkey",
    "st_reduceprecision",
    "st_removerepeatedpoints",
    "st_reverse",
    "st_rotate",
    "st_rotatex",
    "st_rotatey",
    "st_rotatez",
    "st_scale",
    "st_shortestline",
    "st_simplify",
    "st_simplifypreservetopology",
    "st_snap",
    "st_startpoint",
    "st_symdifference",
    "st_tileenvelope",
    "st_touches",
    "st_translate",
    "st_transscale",
    "st_union",
    "st_union_agg",
    "st_voronoidiagram",
    "st_within",
    "st_withinproperly",
    "st_x",
    "st_xmax",
    "st_xmin",
    "st_y",
    "st_ymax",
    "st_ymin",
    "st_z",
    "st_zmax",
    "st_zmflag",
    "st_zmin"
  ],
  "elevated": [
    "duckdb_proj_compiled_version",
    "duckdb_proj_version",
    "pragma_rtree_index_info",
    "rtree_index_dump",
    "rtree_index_scan",
    "shapefile_meta",
    "st_drivers",
    "st_generatepoints",
    "st_read",
    "st_read_meta",
    "st_readosm",
    "st_readshp",
    "st_transform"
  ]
}
