{
  "name": "httpfs",
  "reviewed_duckdb": "1.5.5",
  "source": "https://github.com/uwdata/mosaic/tree/3eb74ea8/packages/server/duckdb-server-go/pkg/functionset/httpfs.go",
  "notes": [
    "Source: https://github.com/duckdb/duckdb-httpfs/tree/827222fb45a043a7a852d1f7aae46901492a3cda"
  ],
  "compute": [],
  "elevated": []
}
