{
  "name": "inet",
  "reviewed_duckdb": "1.5.5",
  "source": "https://github.com/duckdb/duckdb-inet/tree/fe7f60bb60245197680fb07ecd1629a1dc3d91c8",
  "notes": [
    "Source: https://github.com/duckdb/duckdb-inet/tree/fe7f60bb60245197680fb07ecd1629a1dc3d91c8"
  ],
  "compute": [
    "+",
    "-",
    "<<=",
    ">>=",
    "broadcast",
    "family",
    "host",
    "html_escape",
    "html_unescape",
    "netmask",
    "network"
  ],
  "elevated": []
}
