{
  "name": "ui",
  "reviewed_duckdb": "1.5.5",
  "source": "https://github.com/duckdb/duckdb-ui/tree/26084e6e02cc7f47ba0361daef646d75974908d9",
  "notes": [
    "UI is distributed separately; DuckDB's checkout has no UI build descriptor. This independent source pin is not cross-checked against an engine descriptor.",
    "Source: https://github.com/duckdb/duckdb-ui/tree/26084e6e02cc7f47ba0361daef646d75974908d9"
  ],
  "compute": [],
  "elevated": [
    "get_ui_url",
    "start_ui",
    "start_ui_server",
    "stop_ui_server",
    "ui_is_started"
  ]
}
