{
  "name": "mysql",
  "reviewed_duckdb": "1.5.5",
  "source": "https://github.com/uwdata/mosaic/tree/3eb74ea8/packages/server/duckdb-server-go/pkg/functionset/mysql.go",
  "notes": [
    "Source: https://github.com/duckdb/duckdb-mysql/tree/7267164dab3409e943261aeee6ae32f1b00847a7"
  ],
  "compute": [],
  "elevated": [
    "mysql_clear_cache",
    "mysql_debug_execution_plan",
    "mysql_execute",
    "mysql_explain_federated",
    "mysql_query"
  ]
}
