{
  "name": "tpcds",
  "reviewed_duckdb": "1.5.5",
  "source": "https://github.com/duckdb/duckdb/tree/d8cdaa33fda8df955cc76ef58a280f68f4cd43fa/extension/tpcds",
  "notes": [
    "These inventories match DuckDB 1.5.5 at d8cdaa33fda8df955cc76ef58a280f68f4cd43fa."
  ],
  "compute": [
    "tpcds_answers",
    "tpcds_queries"
  ],
  "elevated": [
    "dsdgen",
    "tpcds"
  ]
}
