{
  "name": "autocomplete",
  "reviewed_duckdb": "1.5.5",
  "source": "https://github.com/uwdata/mosaic/tree/3eb74ea8/packages/server/duckdb-server-go/pkg/functionset/autocomplete.go",
  "notes": [
    "These inventories match DuckDB 1.5.5 at d8cdaa33fda8df955cc76ef58a280f68f4cd43fa."
  ],
  "compute": [
    "check_peg_parser"
  ],
  "elevated": [
    "disable_peg_parser",
    "enable_peg_parser",
    "sql_auto_complete"
  ]
}
