{
  "name": "aws",
  "reviewed_duckdb": "1.5.5",
  "source": "https://github.com/uwdata/mosaic/tree/3eb74ea8/packages/server/duckdb-server-go/pkg/functionset/aws.go",
  "notes": [
    "Source: https://github.com/duckdb/duckdb-aws/tree/efa54a990e16c976576685dd4134d2478cf5a574"
  ],
  "compute": [],
  "elevated": [
    "load_aws_credentials"
  ]
}
