{
  "name": "tpch",
  "reviewed_duckdb": "1.5.5",
  "source": "https://github.com/uwdata/mosaic/tree/3eb74ea8/packages/server/duckdb-server-go/pkg/functionset/tpch.go",
  "notes": [
    "These inventories match DuckDB 1.5.5 at d8cdaa33fda8df955cc76ef58a280f68f4cd43fa."
  ],
  "compute": [
    "tpch_answers",
    "tpch_queries"
  ],
  "elevated": [
    "dbgen",
    "tpch"
  ]
}
