{
  "name": "postgres",
  "reviewed_duckdb": "1.5.5",
  "source": "https://github.com/uwdata/mosaic/tree/3eb74ea8/packages/server/duckdb-server-go/pkg/functionset/postgres.go",
  "notes": [
    "Source: https://github.com/duckdb/duckdb-postgres/tree/41223e51559cd581f1c06e170b71c71df25bbaac"
  ],
  "compute": [
    "postgres_hstore_get",
    "postgres_hstore_to_json"
  ],
  "elevated": [
    "pg_clear_cache",
    "postgres_attach",
    "postgres_configure_pool",
    "postgres_execute",
    "postgres_query",
    "postgres_scan",
    "postgres_scan_pushdown",
    "read_postgres_binary"
  ]
}
