{
  "name": "ducklake",
  "reviewed_duckdb": "1.5.5",
  "source": "https://github.com/uwdata/mosaic/tree/3eb74ea8/packages/server/duckdb-server-go/pkg/functionset/ducklake.go",
  "notes": [
    "Source: https://github.com/duckdb/ducklake/tree/d8a1881e22516ea3d186d73e83c65fe5bd1a1dc4"
  ],
  "compute": [
    "murmur3_32"
  ],
  "elevated": [
    "ducklake_add_data_files",
    "ducklake_cleanup_old_files",
    "ducklake_commit",
    "ducklake_current_snapshot",
    "ducklake_delete_orphaned_files",
    "ducklake_expire_snapshots",
    "ducklake_flush_inlined_data",
    "ducklake_last_committed_snapshot",
    "ducklake_list_files",
    "ducklake_merge_adjacent_files",
    "ducklake_options",
    "ducklake_rewrite_data_files",
    "ducklake_scan",
    "ducklake_set_commit_message",
    "ducklake_set_option",
    "ducklake_settings",
    "ducklake_snapshots",
    "ducklake_table_changes",
    "ducklake_table_deletions",
    "ducklake_table_info",
    "ducklake_table_insertions"
  ]
}
