{
  "name": "vss",
  "reviewed_duckdb": "1.5.5",
  "source": "https://github.com/uwdata/mosaic/tree/3eb74ea8/packages/server/duckdb-server-go/pkg/functionset/vss.go",
  "notes": [
    "Source: https://github.com/duckdb/duckdb-vss/tree/b833341c8737fd3f3558c7720cc575ae8fc82598"
  ],
  "compute": [],
  "elevated": [
    "hnsw_compact_index",
    "hnsw_index_scan",
    "pragma_hnsw_index_info",
    "vss_join",
    "vss_match"
  ]
}
